Year,Page,Center_name,Street_address,City,State,Postal_code,Phone,Keys
1998,12,Lighthouse of Tallapoosa County Inc,36 Franklin Street,Alexander City,AL,35010,(205)234-4894,TX RR HH
1998,12,Anniston Fellowship House Inc,106 East 22nd Street,Anniston,AL,36201,(256)236-7229,TX RR HH CJ
1998,12,Calhoun/Cleburnc Mental Health Center New Directions,331 East 8th Street,Anniston,AL,36202,(256)236-3403Hotlines:(256)236-3403(256)236-8003,TX PV OS OR IO AD DD SS CM
1998,12,Alcoholism Recovery Services Inc,2701 Jefferson AvenueSW,Birmingham,AL,35211,(205)923-6552,TX PV OS DT OR IO RD RR HV SS OH MD
1998,12,Aletheia House,201 Finley Avenue West,Birmingham,AL,35204,(205)324-6502,TX OS OR IO SS MD
1998,12,Birmingham Health Carefor The Homeless,71225th Street North,Birmingham,AL,35203,(205)439-7216,TX PV OS OR IO SS FG
1998,12,Bradford Health Services Birmingham Regional Office Jefferson,631 Beacon Parkway West Suite 211,Birmingham,AL,35209,(800)293-7191,TX OS OR IO AD DD SS
1998,12,Department of Veterans Affairs Medical Center,171711th Avenue South,Birmingham,AL,35205,(205)939-2135,TX OS OR DD GH FG
1998,12,Fellowship House Inc,162512th Avenue South,Birmingham,AL,35205,(205)933-2430,TX PV OS RR DD HH FG
1998,12,Hill Crest Behavioral Health Services Chemical Dependency Track,6869 Sth Avenue South,Birmingham,AL,35212,(205)833-9000Hotlines:(205)833-9000(800)292-8553,TX PV OS DT OR IO ID IR AD DD SS PH TC CM SG SC
1998,12,efferson County Economic Opportunity Alcoholism Outreach/Aftercare Program,3040 Enslcy Avenue,Birmingham,AL,35208,(205)787-3040Hotline:(205)787-3040,TX PV OS IO AD DD SS
1998,12,Oakmont Center,1915 AvenueH Ensley,Birmingham,AL,35218,(205)787-7100,TX PV OS IO AD SS
1998,12,Saint Anncs Home Inc,2772 Hanover Circle,Birmingham,AL,35205,(205)933-2402,TX OS RR DD HV PW SS TC
1998,12,Tri County Treatment Center,500 Gene Reed Road Suite 220,Birmingham,AL,35215,(205)836-3345,ML PV OS DT OD RD RR SS OH
1998,12,Univ of Alabamain Birmingham Hospital Centerfor Psychiatric Medicine,17136th Avenue South,Birmingham,AL,35294-0018,(205)934-9699Hotline:(205)934-7008,TX PV OS DT OD OR IO ID RD RR AD PH MC FG PI
1998,12,University of Alabama Substance Abuse Program,401 Beacon Parkway West,Birmingham,AL,35209,(205)917-3784x231,TX ML PV OS OR IO AD HV PW SS CM CJ MC MD PI
1998,12,Chilton Shelby Mental Health Center Substance Abuse Division,182217th Street Highway 25,Calera,AL,35040,(205)668-2700,TX PV OS IO AD SS CM MD PI
1998,12,Lifeline Services Inc Cherokee County Location,423 East Main Street,Centre,AL,35960,(888)329-0440,TX OR IO SS
1998,12,Ventress Correctional Facility Substance Abuse Services State,Road 239,Clayton,AL,36016,(334)775-3331x305Hotline:(334)775-3331,TX PV RR DD SS TC CJ FG
1998,12,Mental Health Ctr of North CentralAL Quest Rec Ctr Subst Abuse Treatment,1312 Somerville Road,Decatur,AL,35601,(256)353-9116Hotline:(256)355-6091,TX PV OS OR IO DD PW SS MD PI
1998,13,West Alabama Mental Health Center Substance Abuse Program,1215 Walnut Avenue South,Dcmopolis,AL,36732,(334)289-2410Hothncs:(800)239-2901(334)289-2410,TX PV OS OR IO CM MD
1998,13,Spectra Care,831 JohnD Odom Road,Dothan,AL,36303,(334)794-3771Hotline:(334)794-0700,TX RR SS OH
1998,13,Baldwin County Mental Health Center,372 South Greeno Road,Fairhope,AL,36532-1905,(334)990-8961Hotlines:(800)738-2871(800)558-8295,TX PV OS OR IO SS CM MC
1998,13,Riverbcnd Centerfor Mental Health Substance Abuse Services,635 West College Street,Florence,AL,35630,(256)764-3431Hotline:(256)764-3431,TX PV OR AD DD HV PW SS PH TC CM MD PI
1998,13,Cherokee/Etowah/De Kalb Mental Health Center Subst Abuse Servs,901 Goodyear Avenue,Gadsden,AL,35903,(256)492-7800Hotline:(256)492-7800,TX PV OS OR IO DD CM MD
1998,13,The Bridge Inc,3232 Lay Springs Road,Gadsden,AL,35904,(256)546-6324,TX PV OS IO RR AD DD SS SC
1998,13,Marshall/JacksonMH Authority Mountain Lakes Behavioral Health Care,22165 U.S.Highway 431,Guntersville,AL,35976,(256)582-4465Hotlines:(256)582-5339(256)582-4465,TX PV OS OR IO RR DD SS HH CM MD PI
1998,13,Crestwood Medical Ctr of Huntsville Behavioral Services,1 Hospital Drive,Huntsville,AL,35801,(256)880-4260Hotlincs:(256)880-4260(256)880-4280,TX PV OS DT IO ID IR AD DD GH MC MD FG PI
1998,13,Huntsville Metro Treatment Center,2227 Drake Avenue Suite 10-D,Huntsville,AL,35805,(256)881-1311,TX ML OS DT OD OR DD HV PW SS
1998,13,Madison County Mental Health Center New Horizons Recovery Center,600 Saint Clair Street Number 9 Suite 23,Huntsville,AL,35801,(256)532-4141,TX PV OS OR IO CM MD PI
1998,13,Pathfinder Inc,3104 Ivy AvenueSW,Huntsville,AL,35805,(256)534-7644,TX RR
1998,13,Northwest Alabama Mental Health Center,11007th Avenu,Hhasper,AL,35501,(205)387-0541x134Hotline:(800)489-3971,TX PV OS OR IO RR SS CM MD FG
1998,13,Maxwell Air Force Base Substance Abuse Program,42 MDOS/SGOM H 330 Kirkpatrick AvenueE,MaxwellAFB,AL,36113-6334,(334)493-4534,TX PV OS DT OD OR IO PW SS GH CM FG
1998,13,Bradford Health Services Mobile Outreach Mobile,1000 Hillcrest Road Suite 304,Mobile,AL,36695,(800)333-0906Hotlines:(334)633-0900(800)333-0906,TX PV OS OR IO SS
1998,13,Dauphin Way Lodge,1009 Dauphin Street,Mobile,AL,36604,(256)438-4729,TX OS IO RR SS HH FG
1998,13,ECD Program,29 SO Springhill Avenue,Mobile,AL,36607,(334)476-1677,TX IO SS
1998,13,Oasis,4211 Government Boulevard,Mobile,AL,36693,(334)666-2569,TX OS OR IO SS OH PI
1998,13,Bradford Health Services Montgomery Outreach Montgomery,100 Mendel Parkway,Montgomery,AL,36117,(800)873-2887Hotline:(334)244-0702,TX PV OS OR IO AD SS
1998,13,Chemical Addictions Program Inc,1153 Air Base Boulevard,Montgomery,AL,36108,(334)265-4544Hotline:(800)762-3790,TX OS IO RR AD SS MD FG
1998,14,Jackson Hospital Psychiatric Unit,1235 Forest Avenue,Montgomery,AL,36106,(334)293-8660,TX DT ID GH MC MD FG PI
1998,14,Lighthouse Counseling Center Inc Intensive Outpatient Unit,1415 East South Boulevard,Montgomery,AL,36116,(334)286-5980,TX PV OS OR IO DD HV PW SS MD PI
1998,14,Meadhaven Addictive Disease Program,2105 East South Boulevard,Montgomery,AL,36116,(334)286-3535,TX PV OS DT OD IO ID IR DD GH MC FG PI
1998,14,Montgomery Metro Treatment Center,4303 Norman Bridge Road,Montgomery,AL,36105,(334)288-5363,TX ML PV OS DT OD OR IO SS GH SG
1998,14,The Freedom House,Route 4,Rogersville,AL,35652,(205)247-1222,TX IO RR PW SS OH HH
1998,14,Sunrise Lodge Substance Abuse Treatment Center,1163 Washington AvenueSW,Russellville,AL,35653,(205)332-0078,TX RR SS MD PI
1998,14,Cahaba Cares Substance Abuse Services,912 Jeff Davis Avenue,Selma,AL,36701,(334)874-2600Hotline:(334)875-2109,TX PV OS OR IO AD HV PW SS CJ MD
1998,14,Central Alabama Veteran Health Care System,2400 Hospital Road,Tuskegee,AL,36083,(334)727-0550x4184,TX PV OS DT OR ID SS GH PH FG
1998,14,Shoals Treatment Center,520 Louise Street,Muscle Shoals,AL,35661,(205)383-6646,TX ML PV OS DT OD OR SS PI
1998,14,Bradford Health Services Oak Mountain Shelby,2280 Highway 35 South,Pelham,AL,35124,(205)664-3480,TX RR AD SS OH FG PI
1998,14,Lifeline Services Inc Russell County Location,1602 Broad Street,Phenix City,AL,36867,(888)329-0440,TX PV OS OR IO SS CJ
1998,14,Self Discovery Inc,59928 Highway 22,Roanoke,AL,36274,(888)283-6747,TX OS DT ID IR GH MC PI
1998,14,The Shoulder,4901 Battleship Parkway,Spanish Fort,AL,36577,(334)626-2199,TX PV OS IO RR SS HH
1998,14,Cheaha Regional Mental Health Mental Retardation Board lnc,1721 Old Birmingham Highway,Sylacauga,AL,35150,(256)249-2395Hotline:(256)245-2201,TX PV OS DT IO RD RR AD SS MD
1998,14,Indian Rivers Mental Health Center Alcoholand Drug Abuse Program,505 19th Avenue,Tuscaloosa,AL,35401,(205)391-0118Hotline:(205)345-1600,TX PV OS OR IO RR DD PW SS CM CH MC MD FG PI
1998,14,Phoenix House Inc,700 35th Avenue,Tuscaloosa,AL,35401,(205)758-3867,TX RR HH FG
1998,14,Tuscaloosa Treatment Center,535 River Road NE Suite G-3,Tuscaloosa,AL,35404,(205)507-0800,TX ML OS DT OD OR SS PI
1998,14,Veterans Affairs Medical Center Primary Care Substance Abuse Clinic,3701 Loop Road East,Tuscaloosa,AL,35404,(205)554-2000x2690,TX PV OS DT OD OR IO SS PH FG
1998,14,Bradford Health Services Warrior Lodge/Jefferson,1189 Allbritton Road,Warrior,AL,35180,(800)333-1865Hotlincs:(205)647-1945(800)648-1945,TX PV OS DT IO RD RR DD SS TC FG PI
1998,14,Bradford Health Servicesat Elmore Community Hospital C/O Elmore Community Hospital,500 Hospital Drive,Wetumpka,AL,36092,(334)567-4311,TX OS DT ID IR GH
1998,15,Akeela Treatment Services,2805 Bering Street Suite 4,Anchorage,AK,99503,(907)561-5266,TX PV OS OR RR SS TC SC CJ MD
1998,15,Alaska Human Services Inc Outpt Alc/Subst Abuse Treatment Prog,4050 Lake Otis Parkway Suite 111,Anchorage,AK,99508,(907)561-4535,TX OS OR IO SS PI
1998,15,Alaska North Addictions Recovery Ctr,4330 Bragaw Street,Anchorage,AK,99508,(907)561-5537,TX PV OS OR IO RR SS MD FG PI
1998,15,Booth Memorial Youthand Family Servs,3600 East 20th Avenue,Anchorage,AK,99508,(907)279-0522,TX PV OS OR IO AD DD PW SS MD
1998,15,Charter North Behavioral Health System,2530 Debarr Road,Anchorage,AK,99508,(907)258-7575Hotlines:(907)258-7575(800)478-7575,TX PV OS DT ID IR AD PH
1998,15,Genesis House Inc,2825 West 42nd Place,Anchorage,AK,99517,(907)243-5130,TX PV OS DT OR IO RD RR DD SS CM FG PI
1998,15,Narcotic Drug Treatment Center Inc Centerfor Drug Problems,520 East 4th Avenue Suite 102,Anchorage,AK,99501-2624,(907)276-6430,TX ML PV OS DT OD OR HV SS MD PI
1998,15,Pacific Rim Counseling Inc,4141 B Street Suite 210,Anchorage,AK,99503,(907)561-5252,TX PV OS OR IO AD DD SS SG CJ PI
1998,15,Providence Alaska Medical Center Providence Breakthrough,2401 East 42nd Avenue Suite 103,Anchorage,AK,99508,(907)562-7325,TX OS OR IO AD DD SS MC PI
1998,15,RITE Inc,301 East Fireweed Lane Suite 102,Anchorage,AK,99503-2110,(907)562-7483,TX PV OS OR IO AD SS PI
1998,15,Salvation Army Clitheroe Center,1709 South Bragaw Street Point Woronzof/West End Road SuiteB,Anchorage,AK,99508,(907)276-2898,TX OS DT OR IO RD RR DD PW SS MD FG PI
1998,15,Southcentral Foundation DenaA Coy,3916 East 9th Avenue,Anchorage,AK,99508,(907)333-6677,TX PV OS OR RR DD PW SS MD FG
1998,15,Veterans AffairsandROC AnchorageAK Addictions Treatment Program,292 S Debarr Road Suite 116,Anchorage,AK,99508,(907)257-4854,TX PV OS DT OD OR IO DD SS FG
1998,15,Volunteers of AmericaARCH/ASSIST,441 West 5th Avenue Suite 301,Anchorage,AK,99501-2340,(907)279-9634,TX PV OS OR IO RR AD SS MD FG PI
1998,15,Kuskokwim Native Association Community Counseling ProgramP.O.BoxI,S 5,Aniak,AK,99557,(907)675-4445Hotline:(800)478-5622,TX PV OS OR CM
1998,15,North Slope Borough Health Substance Abuse Treatment Servs,579 Kingosak Street,Barrow,AK,99723,(907)852-0274Hotlines:(907)852-0274(907)852-0275,TX PV OS DT OD OR RD RR AD SS TC FG
1998,15,Copper River Community Mental Hlth Ctr Substance Abuse Services Mile,104 Old Richardson Highway,Copper Center,AK,99573,(907)822-5241,TX PV OS OR IO DD CM MD FG CO
1998,15,Sound Alternatives Cordova Community Medical Center,602 Chase Avenue Co,Rdova,AK,99574,(907)424-8300,TX PV OS OR AD DD HV CM MC MD PI
1998,15,Bristol Bay Area Health Corp Alcoholismand Drug Abuse Program,,Dillingham,AK,99576,(907)842-5266,TX PV OS DT OR IO RD RR AD DD PW SS MD PI
1998,15,Aleutian Counseling Center,,Dutch Harbor,AK,99692,(907)581-2742,TX PV OS OR AD SS FG
1998,15,Volunteers of America of AlaskaARCHH,C 85,Eagle River,AK,99577,(907)694-3336,TX RR AD DD SS
1998,16,Eielson Air Force Base Substance Abuse Program,354 MDOS/SGOM H 3349 Central Avenue SuiteI,EielsonAFB,AK,99702-2325,(D5N)377-1962,PV OS DT OD DD SS GH FG
1998,16,ElmendorfAFB Substance Abuse Office,3 MDOS/SGOM H 24800 Hospital Drive,ElmendorfAFB,AK,99506,(907)552-8354,TX PV OS DT OD OR IO DD PW SS GH CM FG
1998,16,Fairbanks Memorial Hospital Family Recovery Center,1650 Cowles Street,Fairbanks,AK,99701,(907)458-5540,TX OR IO SS GH PI
1998,16,Graf Rheeneenhaanjii Substance Abuse Services,2550 Lawlor Road,Fairbanks,AK,99701,(907)455-4725,TX OS RD RR AD SS OH MD FG
1998,16,Regional Centerfor Alcoholand Other Addictions,3100 South Cushman Street,Fairbanks,AK,99707,(907)452-6251,TX PV OS DT OR IO RD RR AD DD SS HH FG TC
1998,16,C Regional Prevention Program,122 First Avenue,Fairbanks,AK,99701,(907)452-8251,TX PV OS RR SS TC FG
1998,16,Tanana Chiefs Conference Inc Old Minto Family Recovery Camp,1221st Avenue Suite 600,Fairbanks,AK,99707,(907)452-8251x3158,TX PV OS RR SS FG
1998,16,Tanana Chiefs Conference Inc Yukon Tanana Counseling Services,130221st Avenue,Fairbanks,AK,99701,(907)459-3930,TX PV OS OR CM FG
1998,16,Community Counseling Center,600 Richardson Drive,Fort Richardson,AK,99505,(907)384-1416,TX PV OS OR SS FG
1998,16,Fort Wainwright Alcoholand Drug Abuse Prev Control Prog(ADAPCP),1060 Gaffney Road Suite 6600 MCUC/CCC Building 1064,Fort Wainwright,AK,99703-6600,(907)353-1370,TX PV OS DT OD OR IO SS FG
1998,16,Railbelt Mental Healthand Addicton Dry Creekand Coal Street,,Healy,AK,99743,(907)832-5557,TX PV OS OR IO AD DD SS CM
1998,16,Gastineau Human Services,5597 Aisek Stree,Piuneau,AK,99801,(907)780-4338,TX OS OR RR DD SS
1998,16,Tongass Community Counseling Center,222 Seward Street Suite 20,Piuneau,AK,99801,(907)586-3585,TX PV OS OR AD CO PI
1998,16,Cook Inlet Councilon Alcoholand Drug Abuse(CICADA),10200 Kenai Spur Highway,Kenai,AK,99611,(907)283-3658,TX PV OS OR IO AD SS MD PI
1998,16,Kenaitze Indian Tribe Nakenu,150 North Willow Street,Kenai,AK,99611,(907)283-6693x3,TX PV OS OR AD DD SS CM FG
1998,16,Gateway Centerfor Human Services Substance Abuse Services Division,30505th Avenue,Ketchikan,AK,99901,(907)225-4154Hotline:(907)225-4135,TX PV OS OR IO AD DD SS CM MD PI
1998,16,Ketchikan General Hosp Recovery Center,126 Washington Street,Ketchikan,AK,99901,(907)247-4330Hotline:(907)225-5171,TX PV OS OR IO AD SS GH
1998,16,Ketchikan Indian Corporation,355 Carlanna Lake Road,Ketchikan,AK,99901,(907)225-4061x13,TX PV OS OR AD SS FG
1998,16,Kodiak Councilon Alcoholism Inc,115 Mill Bay Road,Kodiak,AK,99615,(907)486-3535,TX PV OS OD OR IO RR DD HV PW SS MD
1998,16,Maniilaq Addictionsand Support Mantilaq Association Frank Ferguson Building DandE Wings,,Kotzebue,AK,99752,(907)442-7640x139,TX PV OS DT OD OR IO RD RR DD SS GH TC CM PI MC
1998,16,Four Rivers Counseling Services McGrath/Anvik EducationandMH Assoc,229 Joaquin Street Mc,Grath,AK,99627,(907)524-3781Hotline:(800)478-3781,TX PV OS OR IO SS CM
1998,17,Annette Island Service Unit Family Services,,Metlakatla,AK,99926,(907)886-4325,TX PV OS OR IO AD SS
1998,17,Northern Lights Recovery Center,5th Avenueand Division Streets Community Health Services Building,Nome,AK,99762,(907)443-3344,TX OS OR IO RR DD PW SS TC MD FG PI
1998,17,Changing Tides Counseling Services,201 North Nordic Street Suites 204 and 205,Pctcrsburg,AK,99833,(907)772-3552,TX PV OS OR AD SS MD
1998,17,Pribil of Counseling Center,,Saint Paul Island,AK,99660,(907)546-2342,TX PV OS OR AD SS OH
1998,17,Eastern Aleutian Tribes Inc Main Street,,Sand Point,AK,99661,(907)383-5421Hotline:(800)478-2673,TX PV OS OR IO AD DD SS CM
1998,17,Seldovia Village Tribe/SKIAP,274 Main Street,Seldovia,AK,99663-0197,(907)234-7807,TX PV OS OR AD SS
1998,17,Seward Life Action Council,504 Adams Street,Seward,AK,99664,(907)224-5257Hotline:(907)224-3027,TX PV OS OR SS CM MD PI
1998,17,Ravens Way/SEARHC Adolescent Residential Treatment Prog,222 Tongass Drive,Sitka,AK,99835,(907)966-8714,TX OS RR AD DD SS MD FG PI
1998,17,Sitka Preventionand Trt Services Inc Headquarters,509 Lincoln Street,Sitka,AK,99835,(907)747-3500,TX PV OS OR IO AD SS HH
1998,17,Sitka Preventionand Trt Services Inc,509 Lincoln Street,Sitka,AK,99835,(907)747-3500,TX PV OS OR IO RR AD HV PW CO MD PI
1998,17,SoutheastAK Regional Hlth Consortium Community Family Services Program,222 Tongass Drive,Sitka,AK,99835,(907)966-8710,TX PV OS OR IO SS FG
1998,17,Upper Tanana Alcohol Program Tok Clinic Building Tok Cut-Off,,Tok,AK,99780,(907)883-5185,TX PV OS OR IO CH
1998,17,Valdez Counseling Center,337 Egan Avenue,Valdez,AK,99686,(907)835-2838Hotline:(907)835-2999,TX PV OS OR IO AD CM
1998,17,Alaska Addiction Rehab Services Nugens Ranch,3701 Palmer Wasilla Street,Wasilla,AK,99654,(907)376-4534,TX OS DT RD RR DD SS TC
1998,17,MAT/SU Recovery Center Incorporated,2801 Bogard Road,Wasilla,AK,99654,(907)376-4000Hotline:(907)376-4000,TX PV OS OR IO AD DD PW SS CJ MD PI
1998,17,Avenues,406 Alaska Avenue,Wrangell,AK,99929,(907)874-3338,TX PV OS OR SS MD
1998,18,SMMHC Inc Mental Health Ctr/Subst Abuse Services,564 North Idaho Road Suite 9,Apache Junction,AZ,85220,(480)983-0065,TX PV OS OR IO CM
1998,18,Southeastern Arizona Behavioral Health Services(SEABHS) Admin Unit,590 South Ocotillo Avenue,Benson,AZ,85602,(520)586-7080Hotline:(800)586-9161,TX PV OS OR DD CM FG
1998,18,Mohave Mental Health Clinic Outpatientand Day Treatment,2135 Highway 9 S Suites 125 and 241,Bullhead City,AZ,86442,(520)758-5905,TX IO AD DD SS CM
1998,18,Camp Verde Yavapai/Apache Alcohol/Substance Abuse Program,,Camp Verde,AZ,86322,(520)567-3977,TX PV OS OR SS FG
1998,18,Verde Valley Guidance Clinic Inc,497 Main Street Suite 4,Camp Verde,AZ,86322,(520)634-2236Hotline:(520)634-2236,TX PV OS DT OD OR IO AD DD PW CM
1998,18,Against Abuse Inc,,Casa Grande,AZ,85230-0733,(520)836-1239,TX PV OS OR CM MD
1998,18,Behavioral Health Agency of Central Arizona,120 West Main Street,Casa Grande,AZ,85222-4820,(520)836-1688,TX PV OS OR DD HV SS CM MC MD
1998,18,PGBHABHACA Casa Grande Outpatient,120 West Main Street,Casa Grande,AZ,85222-4820,(520)836-1675,TX PV OS OR IO DD HV SS CM MC MD
1998,18,PGBHA Helping Associateslnc,1901 North Trekell Road SuiteA,Casa Grande,AZ,85222,(520)836-1029,TX OS OR IO HV SS
1998,18,Centrode Amistad Inc,100 West Boston Street Suite 5,Chandler,AZ,85224,(480)839-2926,TX PV OS OR IO AD DD PW SS CM
1998,18,Chandler Valley Hopeand Drug Trt Ctr,501 North Washington Street,Chandler,AZ,85225,(480)899-3335Hotlines:(480)899-3335(800)544-5101,TX PV OS DT RD RR SS OH TC PI
1998,18,Verde Valley Guidance Clinic Inc,19 East Beech Street,Cottonwood,AZ,86326,(520)634-2236Hotline:(520)634-2236,TX PV OS DT OD OR IO AD DD PW CM MD
1998,18,Dilcon Agency Dept of Behavioral Health Services Old Pre School Building Next Chapter House,,Di Ikon,AZ,86047,(520)657-8000,TX PV OS IO SS OH CM CJ FG
1998,18,PGBHA Pinal County Hispanic Council,712 North Main Street,Eloy,AZ,85231,(520)466-3608,TX PV OS OR IO AD DD SS MD FG PI
1998,18,Aspen Hill Behavioral Health System,305 West Forest Avenue,Flagstaff,AZ,86001,(520)773-1060Hotline:(800)336-2773,TX PV OS DT OR IO ID AD DD SS PH CM MC MD PI
1998,18,Community Medical Services,2559 East 7th Avenue,Flagstaff,AZ,86004-3722,(520)714-0010,TX ML OS DT OD OR IO DD SS MD
1998,18,The Guidance Center,2187 North Vickey Street,Flagstaff,AZ,86004,(520)527-1899,TX PV OS DT OD OR IO RD RR AD DD PH CM MC MD PI
1998,18,Fort Defiance Outpatient Treatment Ctr Fort Defiance Agency,25 Saint Avenue Drive,Fort Defiance,AZ,86504,(520)729-4012,TX PV OS OR IO RR AD DD PW SS MD
1998,18,Fort McDowell Indian Community Familyand Community Services,Yavapai Road,Fort McDowell,AZ,85264,(480)816-7131,TX PV OS OR IO AD SS CM CO
1998,18,Community Care Network(CCN) Jewish Familyand Childrens Services,6376 West Bell Road,Glendale,AZ,85308,(602)395-8900,TX OS IO AD DD SS
1998,19,Maverick House,7022 North 48th Avenue,Glendale,AZ,85301,(623)931-5810,TX PV OS OR RR DD SS TC MC MD PI
1998,19,Thunderbird Samaritan Behavioral Hlth,5555 West Thunderbird Road,Glendale,AZ,85306,(602)588-4799Hotline:(602)230-4357,TX OS DT ID GH MC MD PI
1998,19,La Frontera CenterBLNA,1151 South LaCanada Suite 105,Green Valley,AZ,85614,(602)625-0876,TX PV OS DT OD IO ID DD PW CM
1998,19,Community Counseling Centers Inc,105 North 5th Avenue,Holbrook,AZ,86025,(520)524-6126Hotline:(520)524-6126,TX PV OS DT OD OR IO CM
1998,19,Kayenta Outpatient Treatment Center,,Kayenta,AZ,86033,(520)697-5570,TX PV OS OR AD DD SS
1998,19,Copper Communities Resourceand Development Inc,1116 Tilbury Street,Kearny,AZ,85237,(602)363-5561,TX PV OS OR AD DD CO
1998,19,Mohave Mental Health Clinic Substance Abuse Services,1750 Beverly Street,Kingman,AZ,86401,(520)757-8111,TX OS IO DD SS SG
1998,19,Mohave Mental Health Clinic Substance Abuse Services,2187 Swanson Street,Lake Havasu City,AZ,86403,(520)855-7806,TX PV OS OR IO AD DD SS CM CH
1998,19,Luke Air Force Base Substance Abuse Program,52 MDOS/SGOM H 7219 North Litchfield Road,LukeAFB,AZ,85309-1525,(623)856-7580,TX PV OS OR IO SS GH CM FG
1998,19,Mental Health Clinic Substance Abuse Control,56 MDOS/SGOM H 7219 North Litchfield Road,LukeAFB,AZ,85309-1525,(623)856-4185,TX PV OS OR IO DD SS GH FG
1998,19,Centro DeAmistad Inc Mesa Office,734 East Broadway SuiteC,Mesa,AZ,85204,(480)833-0227,TX PV OS OR IO AD DD SS CM
1998,19,East Valley Addiction Councillnc,554 South Bellview Street,Mesa,AZ,85204,(480)962-7922,TX PV OS DT OR IO RD
1998,19,East Valley Catholic Social Services,430 North Dobson Road Suite 110,Mesa,AZ,85201,(480)964-8771,TX OS OR CO MD
1998,19,New Hope Behavioral Health Centerlnc,6550 Broadway Suite 101,Mesa,AZ,85206,(480)981-1022,TX ML OS DT OD OR SS SG
1998,19,Prehab of Arizona Inc Centerfor Family Enrichment,1655 East University Drive,Mesa,AZ,85203,(480)969-6955,TX OS OR AD DD HV PW SS
1998,19,Prehab of Arizona Inc Helaman House,2613 South Power Road,Mesa,AZ,85206,(480)461-5075,TX PV OS RR AD DD SS FG
1998,19,Prehab of Arizona Inc Homestead Residence,1131 East University Drive,Mesa,AZ,85203,(480)969-8961,TX PV OS RR AD DD SS TC SC CJ FG
1998,19,Samaritan Behavioral Health Desert,2225 West Southern Avenue,Mesa,AZ,85202,(480)464-4141Hotlines:(800)254-4357(602)254-4357,TX OS DT OD OR IO ID DD HV SS GH PH
1998,19,Womenin New Recovery,540 West 1st Street,Mesa,AZ,85201,(480)464-5764Hotline:(480)464-5764,TX PV OS RR DD HV SS HH
1998,19,SEABHS Admtntstrattve Offtce Burro Alleyand Coronado Boulevard,,Morenci,AZ,85540,(520)865-4531Hotline:(800)586-9161,TX PV OS OR IO AD DD SS CM FG
1998,19,Santa Cruz Family Guidance Center Division Inc(SEABHS),489 North Arroyo Boulevard,Nogales,AZ,85621,(520)287-4713Hotlines:(520)287-9009(800)586-9161,TX PV OS OD OR IO AD DD HV PW SS CM MD PI
1998,19,Tri Community Resource Center,980 Mount Lemmon Road,Oracle,AZ,85623,(520)896-9240,TX PV OS OR DD CM MD PI
1998,20,Kaibeto Outpatient Treatment CenterDBHS,337 North Navajo Street,Page,AZ,86040,(520)645-2109Hotline:(520)673-3267,TX PV OS OR IO AD SS OH CM SC CJ
1998,20,Colorado River Indian Tribes Behavioral Health Services RouteI,,Parker,AZ,85344,(520)669-6093,TX OS DT RD RR SS TC CM CJ
1998,20,New Life Guidance Center,1200 Arizona Avenue,Parker,AZ,85344,(520)669-6161Hotline:(520)453-0286,TX OS OR SS CM CJ PI
1998,20,Public Health Scrvicc Indian Hospital Substance Abuse Servs,Route 1,Parker,AZ,85344,(520)669-2137x324,TX PV OS DT OD OR ID DD SS GH CM FG
1998,20,Rim Guidance Center,404 West Aero Drive,Payson,AZ,85547,(520)474-3303,TX OS OR IO CM MC MD PI
1998,20,Hualapai Health Department Alcoholismand Drug Abuse Program,960 Rodeo Way,Peach Springs,AZ,86434,(520)769-2207,TX PV OS OR IO RR AD DD SS FG
1998,20,Behavioral Systems Southwest,2846 East Roosevelt Street,Phoenix,AZ,85008,(602)273-6293,TX PV OS OR RR DD HH
1998,20,Calvary Rehabilitation Center,720 East Montebello Avenue,Phoenix,AZ,85014,(602)279-1468,TX PV OS OR IO RR DD SS TC PI
1998,20,CarlT HaydenVA Medical Center Substance Abuse Treatment Program,650 East Indian School Road Suite 11-A 9,Phoenix,AZ,85012,(602)277-5551x7574,TX OS OR IO DD GH FG
1998,20,Casa DeAmigas,1648 West Cotler Street Suite 8,Phoenix,AZ,85015,(602)265-9987,TX OS RR PW SS MD
1998,20,Chicanos Por LaCausa Inc Centro DeLa Familia,4622 West Indian School Road SuiteD-12,Phoenix,AZ,85009,(623)247-0464,TX PV OS OR IO AD DD HV SS CM CO CJ MD PI
1998,20,Community Medical Services Inc Larkspur Medical Center,12426 North 28th Drive,Phoenix,AZ,85029,(602)866-9378,TX ML PV OS DT OD OR DD HV PW SS MD
1998,20,Corazon/CPLC Corazon,3639 West Lincoln Street,Phoenix,AZ,85009,(602)233-9747,TX OS RR SS TC PI
1998,20,Crossroads,1845 East Ocotillo Road,Phoenix,AZ,85016,(602)279-2585,TX PV OS RR HH FG
1998,20,Drugand Alcohol Treatment Institute Clarence Lawson Foundation,2230 North 24th Street,Phoenix,AZ,85008,(602)275-3233,TX ML OS DT OD OR SS PI
1998,20,Ebony House Inc,6222 South 13th Street,Phoenix,AZ,85040,(602)276-4288x8602,TX OS IO RR DD SS TC MD
1998,20,Family Service Agency,1530 East Flower Street,Phoenix,AZ,85014,(602)264-9891,TX PV OS OR AD DD PW CM
1998,20,Hohokam Room,1501 East Washington Street,Phoenix,AZ,85034,(602)253-6553,TX ML DT OD OR SS SG MC
1998,20,Indian Rehabilitation Inc,650 North 2nd Avenue,Phoenix,AZ,85003,(602)254-3247,TX PV OS OR IO RR PW SS TC MD FG
1998,20,Intensive Treatment Systems Inc,651 West Coolidge Street,Phoenix,AZ,85013,(602)248-0550,TX ML OS DT OD OR SS
1998,20,ewish Familyand Childrens Service,2033 North 7th Street,Phoenix,AZ,85006,(602)257-1904,TX OS OR CO MD FG PI
1998,20,National Councilon Alcand Drug Dcpnd Centraland Northern Arizona,2701 North 16th Street Suite 103,Phoenix,AZ,85006,(602)264-6214Hotline:(602)285-1064,TX PV OS OR IO PW SS SC MD
1998,20,New Arizona FamilyIISMI Dual Diagnosis Program,302 East Southern Avenue,Phoenix,AZ,85040,(602)243-0562Hotline:(602)243-0562,TX PV OS OR IO RR DD SS TC
1998,20,New Arizona Family Inc New Arizona FamilyI,3301 East Pinchot Avenue,Phoenix,AZ,85018,(602)381-0686Hotline:(602)381-0686,TX PV OS OR IO RR DD HV PW SS TC
1998,21,New Lifefor Girls,6216 North 27th Avenue,Phoenix,AZ,85017,(602)246-2704,TX OS DT RD RR SS TC CO
1998,21,PheonixLARC Meta Center Public Inebriate Program,2770 East Vanburen Street,Phoenix,AZ,85008-6039,(602)273-9999Hotlines:(602)222-9444(800)631-1314,TX DT RD RR SS CH MD
1998,21,Phoenix Indian Center,2601 North 3rd Street Suite 100,Phoenix,AZ,85004,(602)263-1017,TX OS OR CM MD
1998,21,Progress Valley Phoenix,4430 North 23rd Avenue,Phoenix,AZ,85015,(602)274-5424,TX OS RR DD PW SS TC
